{
  "profile_id": "ruby-business-profile-v1",
  "public_domain": "https://www.rubyscakedelights.shop/",
  "source_site_role": "reference-only",
  "store_information": {
    "business_name": {"value": "Ruby's Cake Delights", "source": "user_confirmed", "verification_status": "verified", "verified_at": "2026-08-28T23:32:00+09:00", "verified_by": "CEO / business owner", "notes": "Exact customer-facing business name confirmed directly by the business owner."},
    "business_description": {"value": "Ruby's Cake Delights is a neighborhood food and dessert shop in Ichikawa, Chiba, offering handcrafted cakes, pastries, desserts, and satisfying savory meals for everyday enjoyment and special occasions. Alongside our sweets, our growing food menu includes favorites such as Spaghetti, Palabok, Baked Macaroni, and Fried Chicken in a variety of flavors. We prepare our products with care and welcome customers for convenient pickup at our Ichikawa shop.", "source": "user_confirmed", "verification_status": "verified", "verified_at": "2026-08-28T23:59:20+09:00", "verified_by": "CEO / business owner", "notes": "CEO/business owner explicitly approved the revised bilingual business description on 2026-08-28. Canonical English and Japanese wording is in docs/RUBY_BUSINESS_PROFILE_CUSTOMER_CONTENT_DRAFTS_2026-08-28.md section 1. The separately recorded September 13, 2026 meal rollout remains a business rollout fact only and is not WooCommerce catalog authority."},
    "address": {"value": "〒272-0034 千葉県市川市市川1-26-15花亀ビル1F-B (Chiba-ken, Ichikawa-shi, Ichikawa 1-26-15 Hanakame Bldg. 1F-B)", "source": "user_confirmed", "verification_status": "verified", "verified_at": "2026-08-28T23:32:00+09:00", "verified_by": "CEO / business owner", "notes": "Customer-facing/pickup address confirmed directly by the business owner."},
    "operating_hours": {"value": "Wednesday to Saturday: 14:00-20:00. Pickup hours are the same as operating hours.", "source": "user_confirmed", "verification_status": "verified", "verified_at": "2026-08-28T23:32:00+09:00", "verified_by": "CEO / business owner", "notes": "Current operating/pickup hours as of 2026-08-28. Business owner expects an hours change around mid-September 2026; re-verify before publication or launch after that change."},
    "pickup_instructions": {"value": null, "source": "user_confirmed", "verification_status": "not_applicable", "verified_at": "2026-08-28T23:32:00+09:00", "verified_by": "CEO / business owner", "notes": "No special location-specific pickup instructions at present. The general Pickup & Order Policy has now been approved separately."}
  },
  "contact_information": {
    "phone": {"value": "050-1785-0575", "source": "user_confirmed", "verification_status": "verified", "verified_at": "2026-08-28T22:19:00+09:00", "verified_by": "CEO / business owner", "notes": "Confirmed directly by the business owner. Overall production publication remains separately gated."},
    "email": {"value": "Primary: info@rubyscakedelights.shop; Alias: order@rubyscakedelights.shop", "source": "user_confirmed", "verification_status": "verified", "verified_at": "2026-08-28T23:32:00+09:00", "verified_by": "CEO / business owner", "notes": "Primary customer-contact email and order alias confirmed directly by the business owner."},
    "instagram": {"value": "@rubyscakedelights", "source": "user_confirmed", "verification_status": "verified", "verified_at": "2026-08-28T23:32:00+09:00", "verified_by": "CEO / business owner", "notes": "Official customer-facing Instagram identity confirmed directly by the business owner."},
    "facebook": {"value": "https://www.facebook.com/RubysCakeDelights", "source": "user_confirmed", "verification_status": "verified", "verified_at": "2026-08-28T23:32:00+09:00", "verified_by": "CEO / business owner", "notes": "Official customer-facing Facebook page confirmed directly by the business owner."},
    "other_contact": {"value": null, "source": "user_confirmed", "verification_status": "not_applicable", "verified_at": "2026-08-28T23:32:00+09:00", "verified_by": "CEO / business owner", "notes": "No additional customer contact method is required at present."}
  },
  "policies": {
    "privacy_policy": {"value": null, "source": "not_provided", "verification_status": "unverified", "verified_at": null, "verified_by": null, "notes": "Production privacy policy has not yet been drafted/approved."},
    "terms_conditions": {"value": null, "source": "not_provided", "verification_status": "unverified", "verified_at": null, "verified_by": null, "notes": "Production terms and conditions have not yet been drafted/approved."},
    "cancellation_refund_policy": {"value": "Canonical approved bilingual policy text: docs/RUBY_BUSINESS_PROFILE_CUSTOMER_CONTENT_DRAFTS_2026-08-28.md, section 2 (Cancellation & Refund Policy).", "source": "user_confirmed", "verification_status": "verified", "verified_at": "2026-08-28T23:32:00+09:00", "verified_by": "CEO / business owner", "notes": "Business owner stated the previously drafted information is good for now. Approved structure retains 48+ hours full refund, 24-48 hours 50% fee, and under 24 hours/same-day/no-show 100% fee, subject to separately disclosed special-order deadlines."},
    "pickup_order_policy": {"value": "Canonical approved bilingual policy text: docs/RUBY_BUSINESS_PROFILE_CUSTOMER_CONTENT_DRAFTS_2026-08-28.md, section 3 (Pickup & Order Policy).", "source": "user_confirmed", "verification_status": "verified", "verified_at": "2026-08-28T23:32:00+09:00", "verified_by": "CEO / business owner", "notes": "Business owner stated the previously drafted information is good for now. Current operating/pickup hours remain time-sensitive and require the separate mid-September re-verification already recorded in store_information.operating_hours."},
    "allergen_disclaimer": {"value": "Canonical approved bilingual policy text: docs/RUBY_BUSINESS_PROFILE_CUSTOMER_CONTENT_DRAFTS_2026-08-28.md, section 4 (Allergen Information & Disclaimer).", "source": "user_confirmed", "verification_status": "verified", "verified_at": "2026-08-28T23:32:00+09:00", "verified_by": "CEO / business owner", "notes": "Business owner approved the drafted wording for now. Product-specific ingredient/allergen data and operational process review remain required before production publication where applicable."}
  },
  "excluded_migration_sections": ["products", "categories"],
  "profile_complete": false,
  "production_publish_authorized": false
}
